{
  "tenant_id": "acme-corp",
  "run_id": "run-0001",
  "patch_unit_id": "PU-01",
  "worktree_commit": "cccffff",
  "base_commit": "cccccccccccccccccccccccccccccccccccccccc",
  "artifact_uri": "s3://saena-artifacts/run-0001/PU-01.diff",
  "artifact_hash": "sha256:aaaaaaaaaaaaaaaaaaaaaaaaaaaaaaaaaaaaaaaaaaaaaaaaaaaaaaaaaaaaaaaa",
  "manifest_uri": "s3://saena-artifacts/run-0001/PU-01.manifest.json",
  "changed_files": ["apps/web/docs/new-page.md"],
  "quality_gate_ids": ["gate-lint", "gate-test"],
  "evidence_ids": ["evidence-0001"],
  "contract_hash": "sha256:bbbbbbbbbbbbbbbbbbbbbbbbbbbbbbbbbbbbbbbbbbbbbbbbbbbbbbbbbbbbbbbb",
  "rollback_ref": "git-revert:PU-01",
  "created_at": "2026-07-12T14:00:00Z"
}
